{
  "$schema": "application-contract-inventory.v1.schema.json",
  "schema_identity": "infinium.planning.application-contract-inventory/1.0.0",
  "status": "implementation-active",
  "last_reviewed": "2026-08-28",
  "audited_commit": "2ec3be78da4d05d8c6ada68a3e18544a446f2f03",
  "claim_boundary": "This answer-free inventory records the application RPC surface, current consumers, persistence/readback owners, finite bounds, independent version axes, traceability, and renderer policy after accepted Checkpoint C. WP7/WP8 add a generated closed renderer consumer and executable diagnostic desktop proof for bootstrap, result pagination/detail, progress, all four event variants, transport cancellation, and authoritative resync without mapping targeted verification or generic application authority. Checkpoint D, Phase E, M2 activation, broad analyzer claims, and semantic-oracle qualification remain outside this candidate.",
  "protocol": {
    "package": "infinium.application.v1",
    "service": "ApplicationService",
    "major": 1,
    "minor": 13,
    "application_contract_version": "1.13.0",
    "domain_contract_version": "1.6.0",
    "storage_contract_version": "1.16.0",
    "renderer_contract_version": "1.4.0",
    "schema_fingerprint_sha256": "d234d44dabf902041461b5c2318fd5c71f10eff46e7ec75f9a586812fab014c7",
    "declared_rpc_count": 48,
    "implemented_rpc_count": 42,
    "bounds": {
      "maximum_message_bytes": 1048576,
      "maximum_page_items": 100,
      "maximum_chunk_bytes": 262144,
      "maximum_stream_queue_items": 64,
      "maximum_filter_terms": 16,
      "maximum_sort_terms": 4,
      "maximum_bootstrap_recent_runs": 20
    }
  },
  "rpc_inventory": [
    {
      "rpc": "Negotiate",
      "implementation_state": "implemented",
      "implementation_owner": "src/Infinium.Coordinator/ApplicationGrpcService.cs#Negotiate",
      "current_consumers": [
        "src/Infinium.Application/Runtime/CoordinatorConnection.cs",
        "src/Infinium.ApplicationClient linked CoordinatorConnection used by the least-authority DesktopHost role",
        "src/Infinium.Cli through CoordinatorConnection",
        "integration harnesses"
      ],
      "persistence_readback": [
        "CoordinatorRuntime connection admission; no durable product write"
      ],
      "bounds_and_versions": [
        "ProtocolConstants major/minor, compatibility tuple, nonce, capability count, and negotiated limits"
      ],
      "requirement_ids": [
        "SEC-003",
        "OPS-005"
      ],
      "evaluation_ids": [
        "EVAL-0088",
        "EVAL-0090"
      ],
      "security_authorities": [
        "ADR-0019",
        "ADR-0021",
        "ADR-0037"
      ],
      "renderer_policy": "native-only-never-map"
    },
    {
      "rpc": "Health",
      "implementation_state": "implemented",
      "implementation_owner": "src/Infinium.Coordinator/ApplicationGrpcService.cs#Health",
      "current_consumers": [
        "integration harnesses; no production UI consumer"
      ],
      "persistence_readback": [
        "CoordinatorRuntime authority; no durable product write"
      ],
      "bounds_and_versions": [
        "Negotiated application session and one bounded unary response"
      ],
      "requirement_ids": [
        "OPS-001",
        "OPS-005"
      ],
      "evaluation_ids": [
        "EVAL-0088",
        "EVAL-0090"
      ],
      "security_authorities": [
        "ADR-0019",
        "ADR-0037"
      ],
      "renderer_policy": "typed-projection-mapping-only"
    },
    {
      "rpc": "GetApplicationBootstrap",
      "implementation_state": "implemented",
      "implementation_owner": "src/Infinium.Coordinator/ApplicationGrpcService.cs#GetApplicationBootstrap",
      "current_consumers": [
        "generated C# gRPC consumer, generated C#/TypeScript adapter signature, deterministic story fake client, real narrow desktop application client, WPF/WebView2 diagnostic host, and contract/desktop qualification tests"
      ],
      "persistence_readback": [
        "AuthoritativeStore.ListRuns and CoordinatorRuntime authority; no durable write"
      ],
      "bounds_and_versions": [
        "renderer contract 1.4.0, maximum 20 recent runs, projection version 1, negotiated message limits"
      ],
      "requirement_ids": [
        "OPS-001",
        "OPS-005",
        "SEC-003"
      ],
      "evaluation_ids": [
        "EVAL-0088",
        "EVAL-0090"
      ],
      "security_authorities": [
        "ADR-0019",
        "ADR-0021",
        "ADR-0037"
      ],
      "renderer_policy": "typed-projection-mapping-only"
    },
    {
      "rpc": "ListRuns",
      "implementation_state": "implemented",
      "implementation_owner": "src/Infinium.Coordinator/ApplicationGrpcService.cs#ListRuns",
      "current_consumers": [
        "integration harnesses; no production UI consumer"
      ],
      "persistence_readback": [
        "AuthoritativeStore.ListRuns"
      ],
      "bounds_and_versions": [
        "MaximumPageItems 100, MaximumFilterTerms 16, MaximumSortTerms 4, authenticated five-minute keyset cursor, projection version 1"
      ],
      "requirement_ids": [
        "OPS-002",
        "OPS-005"
      ],
      "evaluation_ids": [
        "EVAL-0088",
        "EVAL-0090"
      ],
      "security_authorities": [
        "ADR-0019",
        "ADR-0037"
      ],
      "renderer_policy": "typed-projection-mapping-only"
    },
    {
      "rpc": "GetRun",
      "implementation_state": "implemented",
      "implementation_owner": "src/Infinium.Coordinator/ApplicationGrpcService.cs#GetRun",
      "current_consumers": [
        "src/Infinium.Cli/Program.cs",
        "integration harnesses"
      ],
      "persistence_readback": [
        "AuthoritativeStore.GetRun"
      ],
      "bounds_and_versions": [
        "Projection version 1 and one bounded unary detail"
      ],
      "requirement_ids": [
        "OPS-002",
        "SCAN-004"
      ],
      "evaluation_ids": [
        "EVAL-0087",
        "EVAL-0088",
        "EVAL-0090"
      ],
      "security_authorities": [
        "ADR-0019",
        "ADR-0037"
      ],
      "renderer_policy": "typed-projection-mapping-only"
    },
    {
      "rpc": "ListFindings",
      "implementation_state": "implemented",
      "implementation_owner": "src/Infinium.Coordinator/ApplicationGrpcService.cs#ListFindings",
      "current_consumers": [
        "no non-test generated-client consumer found at audited commit; deliberately not mapped by WP7"
      ],
      "persistence_readback": [
        "No finding producer/readback path; only an empty unfiltered page is implemented"
      ],
      "bounds_and_versions": [
        "MaximumPageItems 100 and projection version 1; cursor, filters, and sort reject as unsupported"
      ],
      "requirement_ids": [
        "PROD-003",
        "UX-001"
      ],
      "evaluation_ids": [
        "EVAL-0036",
        "EVAL-0092"
      ],
      "security_authorities": [
        "ADR-0019",
        "ADR-0037"
      ],
      "renderer_policy": "typed-projection-mapping-only"
    },
    {
      "rpc": "GetProgress",
      "implementation_state": "implemented",
      "implementation_owner": "src/Infinium.Coordinator/ApplicationGrpcService.cs#GetProgress",
      "current_consumers": [
        "generated C#/TypeScript progress adapter, story fake-client equivalence consumer, and real WPF/WebView2 desktop application client"
      ],
      "persistence_readback": [
        "AuthoritativeStore.GetRun; current progress body is lifecycle-derived and otherwise empty"
      ],
      "bounds_and_versions": [
        "Projection version 1 and one bounded unary snapshot"
      ],
      "requirement_ids": [
        "SCAN-004",
        "OPS-005"
      ],
      "evaluation_ids": [
        "EVAL-0038",
        "EVAL-0088",
        "EVAL-0090"
      ],
      "security_authorities": [
        "ADR-0019",
        "ADR-0037"
      ],
      "renderer_policy": "typed-projection-mapping-only"
    },
    {
      "rpc": "SubmitRunCommand",
      "implementation_state": "implemented",
      "implementation_owner": "src/Infinium.Coordinator/ApplicationGrpcService.Commands.cs#SubmitRunCommand",
      "current_consumers": [
        "src/Infinium.Cli/Program.cs",
        "integration harnesses"
      ],
      "persistence_readback": [
        "AuthoritativeStore durable command and lifecycle transition records",
        "ManagedRunExecutor and ManagedAnalysisOrchestrator"
      ],
      "bounds_and_versions": [
        "Idempotency identity, lifecycle generation, deadline, message bound, and managed orchestration request bound"
      ],
      "requirement_ids": [
        "SCOPE-004",
        "SCAN-005",
        "SEC-003"
      ],
      "evaluation_ids": [
        "EVAL-0038",
        "EVAL-0045",
        "EVAL-0088",
        "EVAL-0090"
      ],
      "security_authorities": [
        "ADR-0019",
        "ADR-0021",
        "ADR-0037"
      ],
      "renderer_policy": "developer-internal-never-map"
    },
    {
      "rpc": "GetDurableCommand",
      "implementation_state": "implemented",
      "implementation_owner": "src/Infinium.Coordinator/ApplicationGrpcService.Commands.cs#GetDurableCommand",
      "current_consumers": [
        "src/Infinium.Cli/Program.cs",
        "integration harnesses"
      ],
      "persistence_readback": [
        "AuthoritativeStore.GetDurableCommand"
      ],
      "bounds_and_versions": [
        "One opaque durable command identity and one bounded reconciliation response"
      ],
      "requirement_ids": [
        "SCAN-005",
        "OPS-002"
      ],
      "evaluation_ids": [
        "EVAL-0038",
        "EVAL-0088",
        "EVAL-0090"
      ],
      "security_authorities": [
        "ADR-0019",
        "ADR-0037"
      ],
      "renderer_policy": "typed-projection-mapping-only"
    },
    {
      "rpc": "SubscribeEvents",
      "implementation_state": "implemented",